CCI ID,Description,NIST Revision,Type
CCI-002952,Defines the time period to maintain visitor access records to the facility where the system resides.,NIST SP 800-53 Revision 5,Policy
CCI-002953,Employ redundant power cabling paths that are physically separated by an organization-defined distance.,NIST SP 800-53 Revision 5,Policy
CCI-002954,Defines the distance by which to physically separate redundant power cabling paths.,NIST SP 800-53 Revision 5,Policy
CCI-002955,"Provide an uninterruptible power supply to facilitate an orderly shutdown of the system, and/or transition of the system to long-term alternate power in the event of a primary power source loss.",NIST SP 800-53 Revision 5,Policy
CCI-002956,Provide an alternate power supply for the system that is activated manually or automatically and that is self-contained.,NIST SP 800-53 Revision 5,Policy
CCI-002957,Provide an alternate power supply for the system that is activated manually or automatically and that is not reliant on external power generation.,NIST SP 800-53 Revision 5,Policy
CCI-002958,Provide an alternate power supply for the system that is activated manually or automatically and that is capable of maintaining minimally required operational capability or full operational capability in the event of an extended loss of the primary power source.,NIST SP 800-53 Revision 5,Policy
CCI-002959,Provides emergency lighting for all areas within the facility supporting essential mission functions.,NIST SP 800-53 Revision 5,Policy
CCI-002960,Provide emergency lighting for all areas within the facility supporting essential business functions.,NIST SP 800-53 Revision 5,Policy
CCI-002961,Employ fire detection systems for the system that activate automatically.,NIST SP 800-53 Revision 5,Policy
CCI-002962,Employ fire detection systems for the system that automatically activate to notify organization-defined personnel or roles and organization-defined emergency responders in the event of a fire.,NIST SP 800-53 Revision 5,Policy
CCI-002963,Defines the personnel or roles to be notified in the event of a fire.,NIST SP 800-53 Revision 5,Policy
CCI-002964,Defines the emergency responders to be notified in the event of a fire.,NIST SP 800-53 Revision 5,Policy
CCI-002965,Employ fire suppression systems for the system that activate automatically and notify organization-defined personnel or roles and organization-defined emergency responders.,NIST SP 800-53 Revision 5,Policy
CCI-002966,Defines the personnel or roles to be automatically notified of any activation of fire suppression systems.,NIST SP 800-53 Revision 5,Policy
CCI-002967,Defines the emergency responders to be automatically notified of any activation of fire suppression systems.,NIST SP 800-53 Revision 5,Policy
CCI-002968,"Ensure that the facility undergoes, on an organization-defined frequency, fire protection inspections by authorized and qualified inspectors.",NIST SP 800-53 Revision 5,Policy
CCI-002969,Defines a frequency with which the facility undergoes fire protection inspections.,NIST SP 800-53 Revision 5,Policy
CCI-002970,Ensure the identified deficiencies are resolved within an organization-defined time period.,NIST SP 800-53 Revision 5,Policy
CCI-002971,Defines the time period within which to resolve deficiencies identified during facility fire protection inspections.,NIST SP 800-53 Revision 5,Policy
CCI-002973,Defines the personnel or roles to be alerted when automated mechanisms detect the presence of water near the system.,NIST SP 800-53 Revision 5,Policy
CCI-002974,Defines types of system components to authorize and control entering and exiting the facility and to maintain records.,NIST SP 800-53 Revision 5,Policy
CCI-002975,Defines controls to employ at alternate work sites.,NIST SP 800-53 Revision 5,Policy
CCI-002976,Defines physical and environmental hazards that could cause potential damage to system components within the facility.,NIST SP 800-53 Revision 5,Policy
CCI-002979,Employ organization-defined asset location technologies to track and monitor the location and movement of organization-defined assets within organization-defined controlled areas.,NIST SP 800-53 Revision 5,Policy
CCI-002980,Defines asset location technologies to track and monitor the location and movement of organization-defined assets within organization-defined controlled areas.,NIST SP 800-53 Revision 5,Policy
CCI-002981,Defines the assets within the organization-defined controlled areas which are to be tracked and monitored for their location and movement.,NIST SP 800-53 Revision 5,Policy
CCI-002982,Defines controlled areas where the location and movement of organization-defined assets are tracked and monitored.,NIST SP 800-53 Revision 5,Policy
CCI-002984,Develop an organization-wide information security program plan that reflects the coordination among organizational entities responsible for information security.,NIST SP 800-53 Revision 5,Policy
CCI-002985,Disseminate an organization-wide information security program plan that provides an overview of the requirements for the security program and a description of the security program management controls and common controls in place or planned for meeting those requirements.,NIST SP 800-53 Revision 5,Policy
CCI-002986,"Disseminate an organization-wide information security program plan that includes the identification and assignment of roles, responsibilities, management commitment, coordination among organizational entities, and compliance.",NIST SP 800-53 Revision 5,Policy
CCI-002987,Disseminate an organization-wide information security plan that reflects the coordination among organizational entities responsible for information security.,NIST SP 800-53 Revision 5,Policy
CCI-002988,"Disseminate an organization-wide information security program plan that is approved by a senior official with responsibility and accountability for the risk being incurred to organizational operations (including mission, functions, image, and reputation), organizational assets, individuals, other organizations, and the Nation.",NIST SP 800-53 Revision 5,Policy
CCI-002989,Protect the information security program plan from unauthorized disclosure.,NIST SP 800-53 Revision 5,Policy
CCI-002990,Protect the information security program plan from unauthorized modification.,NIST SP 800-53 Revision 5,Policy
CCI-002991,Implement a process to ensure that plans of action and milestones for the information security program and associated organizational systems are developed.,NIST SP 800-53 Revision 5,Policy
CCI-002993,Review plans of action and milestones for the security program and associated organization systems for consistency with the organizational risk management strategy and organization-wide priorities for risk response actions.,NIST SP 800-53 Revision 5,Policy
CCI-002994,"Review and update the risk management strategy in accordance with organization-defined frequency or as required, to address organizational changes.",NIST SP 800-53 Revision 5,Policy
CCI-002995,Defines the frequency with which to review and update the risk management strategy to address organizational changes.,NIST SP 800-53 Revision 5,Policy
CCI-002996,Implement an insider threat program that includes a cross-discipline insider threat incident handling team.,NIST SP 800-53 Revision 5,Policy
CCI-002997,Establish a security workforce development and improvement program.,NIST SP 800-53 Revision 5,Policy
CCI-002998,Implement a process for ensuring that organizational plans for conducting security testing activities associated with organizational systems are developed.,NIST SP 800-53 Revision 5,Policy
CCI-002999,Implement a process for ensuring that organizational plans for conducting security testing activities associated with organizational systems are maintained.,NIST SP 800-53 Revision 5,Policy
CCI-003000,Implement a process for ensuring that organizational plans for conducting security training activities associated with organizational systems are developed.,NIST SP 800-53 Revision 5,Policy
CCI-003001,Implement a process for ensuring that organizational plans for conducting security training activities associated with organizational systems are maintained.,NIST SP 800-53 Revision 5,Policy
CCI-003002,Implement a process for ensuring that organizational plans for conducting security monitoring activities associated with organizational systems are developed.,NIST SP 800-53 Revision 5,Policy
CCI-003003,Implement a process for ensuring that organizational plans for conducting security monitoring activities associated with organizational information systems are maintained.,NIST SP 800-53 Revision 5,Policy
CCI-003004,Implement a process for ensuring that organizational plans for conducting security testing associated with organizational systems continue to be executed.,NIST SP 800-53 Revision 5,Policy
CCI-003005,Implement a process for ensuring that organizational plans for conducting security training associated with organizational systems continue to be executed.,NIST SP 800-53 Revision 5,Policy
CCI-003006,Implement a process for ensuring that organizational plans for conducting security monitoring activities associated with organizational systems continue to be executed.,NIST SP 800-53 Revision 5,Policy
CCI-003007,Review testing plans for consistency with the organizational risk management strategy and organization-wide priorities for risk response actions.,NIST SP 800-53 Revision 5,Policy
CCI-003008,Review training plans for consistency with the organizational risk management strategy and organization-wide priorities for risk response actions.,NIST SP 800-53 Revision 5,Policy
CCI-003009,Review monitoring plans for consistency with the organizational risk management strategy and organization-wide priorities for risk response actions.,NIST SP 800-53 Revision 5,Policy
CCI-003010,Establish and institutionalize contact with selected groups and associations within the security community to facilitate ongoing security education and training for organizational personnel.,NIST SP 800-53 Revision 5,Policy
CCI-003011,"Establish and institutionalize contact with selected groups and associations within the security community to maintain currency with recommended security practices, techniques, and technologies.",NIST SP 800-53 Revision 5,Policy
CCI-003012,"Establish and institutionalize contact with selected groups and associations within the security community to share current security information including threats, vulnerabilities, and incidents.",NIST SP 800-53 Revision 5,Policy
CCI-003013,Implement a threat awareness program that includes a cross-organization information-sharing capability for threat intelligence.,NIST SP 800-53 Revision 5,Policy
CCI-003014,Enforce organization-defined mandatory access control policies over all subjects and objects.,NIST SP 800-53 Revision 5,Technical
CCI-003015,Specifies that organization-defined subjects may explicitly be granted organization-defined privileges such that they are not limited by any defined subset (or all) of the above constraints.,NIST SP 800-53 Revision 5,Policy
CCI-003017,Defines the personnel or roles to whom an organization-level; mission/business process-level; and/or system-level personnel security policy is disseminated.,NIST SP 800-53 Revision 5,Policy
CCI-003018,Defines the personnel or roles to whom the personnel security procedures are disseminated.,NIST SP 800-53 Revision 5,Policy
CCI-003019,"Verify that individuals accessing a system processing, storing, or transmitting information requiring special protection have valid access authorizations that are demonstrated by assigned official government duties.",NIST SP 800-53 Revision 5,Policy
CCI-003020,"Verify that individuals accessing a system processing, storing, or transmitting information requiring special protection satisfy organization-defined additional personnel screening criteria.",NIST SP 800-53 Revision 5,Policy
CCI-003021,"Defines additional personnel screening criteria that individuals accessing a system processing, storing, or transmitting information requiring protection must satisfy.",NIST SP 800-53 Revision 5,Policy
CCI-003022,Defines the time period within which to disable system access upon termination of individual employment.,NIST SP 800-53 Revision 5,Policy
CCI-003023,"Upon termination of individual employment, terminate or revoke any authenticators and credentials associated with the individual.",NIST SP 800-53 Revision 5,Policy
CCI-003024,Defines information security topics to be discussed while conducting exit interviews.,NIST SP 800-53 Revision 5,Policy
CCI-003027,"Notify terminated individuals of applicable, legally binding post-employment requirements for the protection of organizational information.",NIST SP 800-53 Revision 5,Policy
CCI-003028,Require terminated individuals to sign an acknowledgment of post-employment requirements as part of the organizational termination process.,NIST SP 800-53 Revision 5,Policy
CCI-003029,Use organization-defined automated mechanisms to notify organization-defined personnel or roles of individual termination actions; and/or disable access to system resources.,NIST SP 800-53 Revision 5,Policy
CCI-003030,"Defines the personnel or roles to be notified by automated mechanism of individual termination actions, and/or disable access to system resources.",NIST SP 800-53 Revision 5,Policy
CCI-003031,Modify access authorization as needed to correspond with any changes in operational need due to reassignment or transfer.,NIST SP 800-53 Revision 5,Policy
CCI-003032,Notify organization-defined personnel or roles within an organization-defined time period when individuals are transferred or reassigned to other positions within the organization.,NIST SP 800-53 Revision 5,Policy
CCI-003033,Defines personnel or roles to be notified when individuals are transferred or reassigned to other positions within the organization.,NIST SP 800-53 Revision 5,Policy
CCI-003034,Defines the time period within which organization-defined personnel or roles are to be notified when individuals are transferred or reassigned to other positions within the organization.,NIST SP 800-53 Revision 5,Policy
CCI-003035,Develop and document access agreements for organizational systems.,NIST SP 800-53 Revision 5,Policy
CCI-003038,"Notify individuals of applicable, legally binding post-employment requirements for protection of organizational information.",NIST SP 800-53 Revision 5,Policy
CCI-003039,"Require individuals to sign an acknowledgement of legally binding post-employment requirements for protection of organizational information, if applicable, as part of granting initial access to covered information.",NIST SP 800-53 Revision 5,Policy
CCI-003041,"Require external providers to notify organization-defined personnel or roles of any personnel transfers or terminations of external personnel who possess organizational credentials and/or badges, or who have system privileges within an organization-defined time period.",NIST SP 800-53 Revision 5,Policy
CCI-003042,Defines personnel or roles whom external providers are to notify when external personnel who possess organizational credentials and /or badges or who have system privileges are transferred or terminated.,NIST SP 800-53 Revision 5,Policy
CCI-003043,"Defines the time period for external providers to notify organization-defined personnel or roles when external personnel who possess organizational credentials and/or badges, or who have system privileges are transferred or terminated.",NIST SP 800-53 Revision 5,Policy
CCI-003044,"Notify organization-defined personnel or roles within an organization-defined time period when a formal employee sanctions process is initiated, identifying the individual sanctioned and the reason for the sanction.",NIST SP 800-53 Revision 5,Policy
CCI-003045,Defines personnel or roles who are to be notified when a formal employee sanctions process is initiated.,NIST SP 800-53 Revision 5,Policy
CCI-003046,Defines the time period within which to notify organization-defined personnel or roles when a formal employee sanctions process is initiated.,NIST SP 800-53 Revision 5,Policy
CCI-003047,Defines the personnel or roles to whom the planning policy is disseminated.,NIST SP 800-53 Revision 5,Policy
CCI-003048,Defines the personnel or roles to whom the planning procedures are disseminated.,NIST SP 800-53 Revision 5,Policy
CCI-003049,Develop security and privacy plans for the system.,NIST SP 800-53 Revision 5,Policy
CCI-003050,Develop security and privacy plans for the system that are consistent with the organization's enterprise architecture.,NIST SP 800-53 Revision 5,Policy
CCI-003051,Develop security and privacy plans for the system that explicitly defines the authorization boundary for the system.,NIST SP 800-53 Revision 5,Policy
CCI-003052,Develop security and privacy plans for the system that describes the operational context of the system in terms of missions and business processes.,NIST SP 800-53 Revision 5,Policy
CCI-003053,"Develop security and privacy plans for the system that provide the security categorization of the system, including supporting rationale.",NIST SP 800-53 Revision 5,Policy
CCI-003054,"Develop security and privacy plans for the system that describe the operational environment for the system and any dependencies on or connections to, other systems or system components.",NIST SP 800-53 Revision 5,Policy
CCI-003055,Develop security and privacy plans for the system that provide an overview of the security and privacy requirements for the system.,NIST SP 800-53 Revision 5,Policy
CCI-003056,"Develop security and privacy plans for the system that identify any relevant control baselines or overlays, if applicable.",NIST SP 800-53 Revision 5,Policy
CCI-003057,"Develop security and privacy plans for the system that describe the controls in place or planned for meeting the security and privacy requirements, including a rationale for any tailoring decisions.",NIST SP 800-53 Revision 5,Policy
CCI-003059,Distribute copies of the plans to organization-defined personnel or roles.,NIST SP 800-53 Revision 5,Policy
CCI-003060,Defines the personnel or roles to whom copies of the plans are distributed.,NIST SP 800-53 Revision 5,Policy
CCI-003061,Communicate subsequent changes to the plans to organization-defined personnel or roles.,NIST SP 800-53 Revision 5,Policy
CCI-003062,Defines the personnel or roles to whom changes to the plans are communicated.,NIST SP 800-53 Revision 5,Policy
CCI-003063,Protect the plans from unauthorized disclosure.,NIST SP 800-53 Revision 5,Policy
CCI-003064,Protect the plans from unauthorized modification.,NIST SP 800-53 Revision 5,Policy
CCI-003068,Review and update the rules of behavior in accordance with organization-defined frequency.,NIST SP 800-53 Revision 5,Policy
CCI-003069,Defines the frequency with which to review and update the rules of behavior.,NIST SP 800-53 Revision 5,Policy
CCI-003070,"Require individuals who have acknowledged a previous version of the rules of behavior to read and re-acknowledge, on an organization-defined frequency, and/or when the rules of behavior are revised or updated.",NIST SP 800-53 Revision 5,Policy
CCI-003071,Develop a security Concept of Operations (CONOPS) for the system describing how the organization intends to operate the system from the perspective of information security.,NIST SP 800-53 Revision 5,Policy
CCI-003072,Develop security architectures for the system.,NIST SP 800-53 Revision 5,Policy
CCI-003073,"Develop security architectures for the system that describes the requirements and approach to be taken for protecting the confidentiality, integrity, and availability of organizational information.",NIST SP 800-53 Revision 5,Policy
CCI-003074,Develop security architectures for the system that describe how the architectures are integrated into and support the enterprise architecture.,NIST SP 800-53 Revision 5,Policy
CCI-003075,"Develop security architectures for the system that describe any assumptions about, and dependencies on, external systems and services.",NIST SP 800-53 Revision 5,Policy
CCI-003076,Review and update the architectures in accordance with organization-defined frequency to reflect updates in the enterprise architecture.,NIST SP 800-53 Revision 5,Policy
CCI-003077,Defines the frequency with which to review and update the system architecture.,NIST SP 800-53 Revision 5,Policy
CCI-003078,Reflect planned security architecture changes in the security plans.,NIST SP 800-53 Revision 5,Policy
CCI-003079,Reflect planned security architecture changes in the security Concept of Operations (CONOPS).,NIST SP 800-53 Revision 5,Policy
CCI-003080,Reflect planned security architecture changes in the security organizational procurements and acquisitions.,NIST SP 800-53 Revision 5,Policy
CCI-003081,Design the security architecture for the system using a defense-in-depth approach that allocates organization-defined controls to organization-defined locations.,NIST SP 800-53 Revision 5,Policy
CCI-003082,Design the security architecture for the system using a defense-in-depth approach that allocates organization-defined controls to organization-defined architectural layers.,NIST SP 800-53 Revision 5,Policy
CCI-003083,Defines the controls to be allocated to organization-defined locations for the security architecture.,NIST SP 800-53 Revision 5,Policy
CCI-003084,Defines the controls to be allocated to the organization-defined security architectural layers.,NIST SP 800-53 Revision 5,Policy
CCI-003085,Defines the locations to which the system allocates organization-defined controls in the security architecture.,NIST SP 800-53 Revision 5,Policy
CCI-003086,Defines the architectural layers to which the system allocates organization-defined controls in the security architecture.,NIST SP 800-53 Revision 5,Policy
CCI-003087,Design the security architecture for the system using a defense-in-depth approach that ensures that the allocated controls operate in a coordinated and mutually reinforcing manner.,NIST SP 800-53 Revision 5,Policy
CCI-003088,Require that organization-defined controls allocated to organization-defined locations and architectural layers be obtained from different suppliers.,NIST SP 800-53 Revision 5,Policy
CCI-003089,Defines the personnel or roles to whom the organization-level; mission/business process-level; and/or system-level system and services acquisition policy is disseminated.,NIST SP 800-53 Revision 5,Policy
CCI-003090,Defines the personnel or roles to whom procedures to facilitate the implementation of the system and services acquisition policy and associated system and services acquisition controls are disseminated.,NIST SP 800-53 Revision 5,Policy
CCI-003091,Determine the high-level information security requirements for the system or system service in mission and business process planning.,NIST SP 800-53 Revision 5,Policy
CCI-003092,Defines a system development life cycle that is used to manage the system.,NIST SP 800-53 Revision 5,Policy
CCI-003093,Integrate the organizational information security risk management process into system development life cycle activities.,NIST SP 800-53 Revision 5,Policy
CCI-003094,"Include the security functional requirements, explicitly or by reference, using standardized contract language; and/or organization-defined contract language in the acquisition contract for the information system, system component, or information system service.",NIST SP 800-53 Revision 5,Policy
CCI-003095,"Include the strength of mechanism requirements, explicitly or by reference, using standardized contract language; and/or organization-defined contract language in the acquisition contract for the information system, system component, or information system service.",NIST SP 800-53 Revision 5,Policy
CCI-003096,"Include the security assurance requirements, explicitly or by reference, using standardized contract language; and/or organization-defined contract language in the acquisition contract for the information system, system component, or information system service.",NIST SP 800-53 Revision 5,Policy
CCI-003097,"Include the security documentation requirements, explicitly or by reference, using standardized contract language; and/or organization-defined contract language in the acquisition contract for the information system, system component, or information system service.",NIST SP 800-53 Revision 5,Policy
CCI-003098,"Include the requirements for protecting security documentation, explicitly or by reference, using standardized contract language; and/or organization-defined contract language in the acquisition contract for the information system, system component, or information system service.",NIST SP 800-53 Revision 5,Policy
CCI-003099,"Include the description of the system development environment and environment in which the system is intended to operate, explicitly or by reference, using standardized contract language; and/or organization-defined contract language in the acquisition contract for the information system, system component, or information system service.",NIST SP 800-53 Revision 5,Policy
CCI-003100,"Include the acceptance criteria, explicitly or by reference, using standardized contract language; and/or organization-defined contract language in the acquisition contract for the information system, system component, or information system service.",NIST SP 800-53 Revision 5,Policy
CCI-003101,"Require the developer of the system, system component, or system service to provide design information for the controls that includes security-relevant external system interfaces, high-level design, low-level design, source code, hardware schematics, and/or organization-defined design information at an organization-defined level of detail.",NIST SP 800-53 Revision 5,Policy
