CCI ID,Description,NIST Revision,Type
CCI-001553,Defines security or privacy policy filters that privileged administrators have the capability to enable and disable.,NIST SP 800-53 Revision 5,Policy
CCI-001554,Defines the security or privacy policy filters that privileged administrators have the capability to configure.,NIST SP 800-53 Revision 5,Policy
CCI-001558,"Defines the security functions (deployed in hardware, software, and firmware) for which access must be authorized.",NIST SP 800-53 Revision 5,Policy
CCI-001564,Defines the frequency of security awareness and training policy reviews and updates.,NIST SP 800-53 Revision 5,Policy
CCI-001565,Defines the frequency of security awareness and training procedure reviews and updates.,NIST SP 800-53 Revision 5,Policy
CCI-001566,Provide organization-defined personnel or roles with initial training in the employment and operation of physical security controls.,NIST SP 800-53 Revision 5,Policy
CCI-001567,"Provide organization-defined personnel or roles with refresher training, thereafter, in the employment and operation of physical security controls in accordance with the organization-defined frequency.",NIST SP 800-53 Revision 5,Policy
CCI-001568,Defines a frequency for providing employees with refresher training in the employment and operation of physical security controls.,NIST SP 800-53 Revision 5,Policy
CCI-001569,Defines the frequency on which the current audit and accountability policy will be reviewed and updated.,NIST SP 800-53 Revision 5,Policy
CCI-001570,Defines the frequency on which the current audit and accountability procedures will be reviewed and updated.,NIST SP 800-53 Revision 5,Policy
CCI-001571,Defines the event types that the system is capable of logging in support of the audit function.,NIST SP 800-53 Revision 5,Policy
CCI-001572,Defines the personnel or roles to be alerted in the event of an audit logging process failure.,NIST SP 800-53 Revision 5,Policy
CCI-001573,Defines whether to reject or delay network traffic that exceeds organization-defined thresholds.,NIST SP 800-53 Revision 5,Policy
CCI-001577,Defines the information system components from which audit records are to be compiled into the system-wide audit trail.,NIST SP 800-53 Revision 5,Policy
CCI-001578,"Defines the frequency to review and update the current assessment, authorization, and monitoring procedures.",NIST SP 800-53 Revision 5,Policy
CCI-001582,Defines other forms of control assessments other than in-depth monitoring; security instrumentation; automated security test cases; vulnerability scanning; malicious user testing; insider threat assessment; performance and load testing; data leakage or data loss assessment that should be included as part of the control assessments.,NIST SP 800-53 Revision 5,Policy
CCI-001584,Defines the frequency with which to review and update configuration management procedures.,NIST SP 800-53 Revision 5,Policy
CCI-001585,Defines the circumstances that require reviews and updates to the baseline configuration of the system.,NIST SP 800-53 Revision 5,Policy
CCI-001586,Defines the configuration change control element responsible for coordinating and providing oversight for configuration change control activities.,NIST SP 800-53 Revision 5,Policy
CCI-001592,Defines the rules authorizing the terms and conditions of software program usage on the system.,NIST SP 800-53 Revision 5,Policy
CCI-001596,Defines the frequency with which to review and update the current contingency planning procedures.,NIST SP 800-53 Revision 5,Policy
CCI-001597,Disseminate contingency planning procedures to organization-defined personnel or roles.,NIST SP 800-53 Revision 5,Policy
CCI-001598,Review and update the current contingency planning procedures in accordance with the organization-defined frequency.,NIST SP 800-53 Revision 5,Policy
CCI-001599,Sustain operational continuity of essential missions until full information system restoration at primary processing and/or storage sites.,NIST SP 800-53 Revision 5,Policy
CCI-001600,Sustains operational continuity of essential business functions until full information system restoration at primary processing and/or storage sites.,NIST SP 800-53 Revision 5,Policy
CCI-001601,Sustain operational continuity of essential mission functions at alternate processing and/or storage sites until system restoration to primary processing and/or storage sites.,NIST SP 800-53 Revision 5,Policy
CCI-001602,Sustain operational continuity of essential business functions at alternate processing and/or storage sites until system restoration at primary processing and/or storage sites.,NIST SP 800-53 Revision 5,Policy
CCI-001604,Outline explicit mitigation actions for potential accessibility problems to the alternate storage site in the event of an area-wide disruption or disaster.,NIST SP 800-53 Revision 5,Policy
CCI-001606,Identify potential accessibility problems to outline explicit mitigation actions.,NIST SP 800-53 Revision 5,Policy
CCI-001609,Activate the redundant secondary system that is not collocated with the primary system without loss of information or disruption to operations.,NIST SP 800-53 Revision 5,Policy
CCI-001610,Defines the time-period (by authenticator type) for changing/refreshing authenticators.,NIST SP 800-53 Revision 5,Policy
CCI-001621,Implement organization-defined security controls to manage the risk of compromise due to individuals having accounts on multiple systems.,NIST SP 800-53 Revision 5,Policy
CCI-001625,"Implement the resulting incident handling activity changes to incident response procedures, training, and testing accordingly.",NIST SP 800-53 Revision 5,Policy
CCI-001628,Defines a frequency with which to review and update the current maintenance procedures.,NIST SP 800-53 Revision 5,Policy
CCI-001631,"After the service is performed, inspect and sanitize the component (for potentially malicious software) before reconnecting the component to the system.",NIST SP 800-53 Revision 5,Policy
CCI-001632,Protect nonlocal maintenance sessions by separating the maintenance session from other network sessions with the system by either physically separated communications paths or logically separated communications paths based upon encryption.,NIST SP 800-53 Revision 5,Technical
CCI-001635,Remove individuals from the facility access list when access is no longer required.,NIST SP 800-53 Revision 5,Policy
CCI-001636,Defines the frequency with which to review and update the current planning policy.,NIST SP 800-53 Revision 5,Policy
CCI-001637,Review and update the current planning policy in accordance with organization-defined frequency.,NIST SP 800-53 Revision 5,Policy
CCI-001638,Defines the frequency with which to review and update the current planning procedures.,NIST SP 800-53 Revision 5,Policy
CCI-001640,Address information security issues in the updating of a critical infrastructure and key resources protection plan.,NIST SP 800-53 Revision 5,Policy
CCI-001641,Defines the process for conducting random vulnerability scans on the system and hosted applications.,NIST SP 800-53 Revision 5,Policy
CCI-001642,"Defines the organizational document in which risk assessment results are documented (e.g., security plan, privacy plan; risk assessment report).",NIST SP 800-53 Revision 5,Policy
CCI-001643,Monitor and scan for vulnerabilities in the system and hosted applications in accordance with the organization-defined process for random scans.,NIST SP 800-53 Revision 5,Policy
CCI-001645,Defines the system components to which privileged access is authorized for organization-defined vulnerability scanning activities.,NIST SP 800-53 Revision 5,Policy
CCI-001646,Defines the frequency with which to review and update the current system and services acquisition procedures.,NIST SP 800-53 Revision 5,Policy
CCI-001661,"Defines the security functions, to at a minimum, include system authentication and re-authentication, for permitting users to invoke the trusted communications path.",NIST SP 800-53 Revision 5,Policy
CCI-001662,Take organization-defined corrective action when organization-defined unacceptable mobile code is identified.,NIST SP 800-53 Revision 5,Technical
CCI-001663,"Provide the means to enable verification of a chain of trust among parent and child domains (if the child supports secure resolution services), when operating as part of a distributed, hierarchical namespace.",NIST SP 800-53 Revision 5,Technical
CCI-001664,Recognize only session identifiers that are system-generated.,NIST SP 800-53 Revision 5,Technical
CCI-001665,Preserve organization-defined system state information in the event of a system failure.,NIST SP 800-53 Revision 5,Technical
CCI-001669,Defines the frequency of testing malicious code protection mechanisms.,NIST SP 800-53 Revision 5,Policy
CCI-001670,Take organization-defined least-disruptive actions to terminate suspicious events.,NIST SP 800-53 Revision 5,Technical
CCI-001671,Analyze outbound communications traffic at selected organization-defined interior points within the system to discover anomalies.,NIST SP 800-53 Revision 5,Policy
CCI-001673,Employ a wireless intrusion detection system to identify rogue wireless devices and to detect attack attempts and potential compromises or breaches to the system.,NIST SP 800-53 Revision 5,Policy
CCI-001675,Defines the personnel or roles that are to receive reports on the results of security function verification.,NIST SP 800-53 Revision 5,Policy
CCI-001678,"Retain information within the system and information output from the system in accordance with applicable federal laws, Executive Orders, directives, policies, regulations, standards, and operational requirements.",NIST SP 800-53 Revision 5,Policy
CCI-001680,"Develop an organization-wide information security program plan that includes the identification and assignment of roles, responsibilities, management commitment, coordination among organizational entities, and compliance.",NIST SP 800-53 Revision 5,Policy
CCI-001682,Automatically removes or disables emergency accounts after an organization-defined time period for each type of account.,NIST SP 800-53 Revision 5,Technical
CCI-001687,Verify that the use of mobile code deployed in system meets organization-defined mobile code requirements.,NIST SP 800-53 Revision 5,Policy
CCI-001688,Verify the acquisition of mobile code deployed in the system meets organization-defined mobile code requirements.,NIST SP 800-53 Revision 5,Policy
CCI-001695,Prevent the execution of organization-defined unacceptable mobile code.,NIST SP 800-53 Revision 5,Technical
CCI-001726,Use software in accordance with contract agreements.,NIST SP 800-53 Revision 5,Policy
CCI-001727,Use software documentation in accordance with contract agreements.,NIST SP 800-53 Revision 5,Policy
CCI-001728,Use software in accordance with copyright laws.,NIST SP 800-53 Revision 5,Policy
CCI-001729,Use software documentation in accordance with copyright laws.,NIST SP 800-53 Revision 5,Policy
CCI-001730,Track the use of software protected by quantity licenses to control copying of the software.,NIST SP 800-53 Revision 5,Policy
CCI-001731,Track the use of software documentation protected by quantity licenses to control distribution of the software documentation.,NIST SP 800-53 Revision 5,Policy
CCI-001732,"Control the use of peer-to-peer file sharing technology to ensure that this capability is not used for the unauthorized distribution, display, performance, or reproduction of copyrighted work.",NIST SP 800-53 Revision 5,Policy
CCI-001733,"Document the use of peer-to-peer file sharing technology to ensure that this capability is not used for the unauthorized distribution, display, performance, or reproduction of copyrighted work.",NIST SP 800-53 Revision 5,Policy
CCI-001734,Defines the restrictions to be followed on the use of open source software.,NIST SP 800-53 Revision 5,Policy
CCI-001735,Establish organization-defined restrictions on the use of open source software.,NIST SP 800-53 Revision 5,Policy
CCI-001736,Defines the number of previous versions of the baseline configuration of the system required to support rollback.,NIST SP 800-53 Revision 5,Policy
CCI-001737,Defines the systems or system components that are to have organization-defined configurations applied when located in areas of significant risk.,NIST SP 800-53 Revision 5,Policy
CCI-001738,Defines the configurations to be implemented on systems and system components when they are located in areas of significant risk.,NIST SP 800-53 Revision 5,Policy
CCI-001739,Issue organization-defined systems or system components with organization-defined configurations to individuals traveling to locations the organization deems to be of significant risk.,NIST SP 800-53 Revision 5,Policy
CCI-001740,Review proposed configuration-controlled changes to the system.,NIST SP 800-53 Revision 5,Policy
CCI-001741,Document configuration change decisions associated with the system.,NIST SP 800-53 Revision 5,Policy
CCI-001742,Defines the approval authorities to be notified when proposed changes to the system are received.,NIST SP 800-53 Revision 5,Policy
CCI-001743,Defines the security responses to be automatically implemented if baseline configurations are changed in an unauthorized manner.,NIST SP 800-53 Revision 5,Policy
CCI-001744,Implement organization-defined security responses automatically if baseline configurations are changed in an unauthorized manner.,NIST SP 800-53 Revision 5,Technical
CCI-001745,Defines the controls that are to be provided by the cryptographic mechanisms are under configuration management.,NIST SP 800-53 Revision 5,Policy
CCI-001746,Ensure that cryptographic mechanisms used to provide organization-defined control are under configuration management.,NIST SP 800-53 Revision 5,Policy
CCI-001751,Defines system-level information requiring enforcement of a dual authorization for system changes.,NIST SP 800-53 Revision 5,Policy
CCI-001752,Enforce dual authorization for implementing changes to organization-defined system-level information.,NIST SP 800-53 Revision 5,"Policy,Technical"
CCI-001753,Limit privileges to change system components within a production or operational environment.,NIST SP 800-53 Revision 5,Policy
CCI-001754,Limit privileges to change system-related information within a production or operational environment.,NIST SP 800-53 Revision 5,Policy
CCI-001755,"Defines the system components for which any deviation from the established configuration settings are to be identified, documented, and approved.",NIST SP 800-53 Revision 5,Policy
CCI-001756,Defines the operational requirements on which the configuration settings for the organization-defined system components are to be based.,NIST SP 800-53 Revision 5,Policy
CCI-001757,Defines the actions to employ when responding to unauthorized changes to the organization-defined configuration settings.,NIST SP 800-53 Revision 5,Policy
CCI-001758,Defines the configuration settings for which to employ organization-defined actions in response to unauthorized changes.,NIST SP 800-53 Revision 5,Policy
CCI-001759,Take organization-defined actions in response to unauthorized changes to organization-defined configuration settings.,NIST SP 800-53 Revision 5,Policy
CCI-001760,"Defines the frequency of system reviews to identify unnecessary and/or nonsecure functions, ports, protocols, software, and services.",NIST SP 800-53 Revision 5,Policy
CCI-001761,"Defines the functions, ports, protocols, software, and services within the information system that are to be disabled or removed when deemed unnecessary and/or nonsecure.",NIST SP 800-53 Revision 5,Policy
CCI-001762,"Disable or remove organization-defined functions, ports, protocols, software, and services within the system deemed to be unnecessary and/or nonsecure.",NIST SP 800-53 Revision 5,Technical
CCI-001763,Defines the policies regarding software program usage and restrictions.,NIST SP 800-53 Revision 5,Policy
CCI-001764,"Prevent program execution in accordance with organization-defined policies, rules of behavior, and/or access agreements regarding software program usage and restrictions; rules authorizing the terms and conditions of software program usage.",NIST SP 800-53 Revision 5,Technical
CCI-001765,Defines the software programs not authorized to execute on the system.,NIST SP 800-53 Revision 5,Policy
CCI-001766,Identify the organization-defined software programs not authorized to execute on the system.,NIST SP 800-53 Revision 5,Policy
CCI-001767,"Employ an allow-all, deny-by-exception policy to prohibit the execution of unauthorized software programs on the system.",NIST SP 800-53 Revision 5,Technical
CCI-001768,Defines the frequency on which the list of unauthorized software programs will be reviewed and updated.,NIST SP 800-53 Revision 5,Policy
CCI-001770,Review and update the list of unauthorized software programs per organization-defined frequency.,NIST SP 800-53 Revision 5,Policy
CCI-001772,Defines the software programs authorized to execute on the system.,NIST SP 800-53 Revision 5,Policy
CCI-001773,Identify the organization-defined software programs authorized to execute on the system.,NIST SP 800-53 Revision 5,Policy
CCI-001774,"Employ a deny-all, permit-by-exception policy to allow the execution of authorized software programs on the system.",NIST SP 800-53 Revision 5,Technical
CCI-001775,Defines the frequency on which the list of authorized software programs will be reviewed and updated.,NIST SP 800-53 Revision 5,Policy
CCI-001777,Review and update the list of authorized software programs per organization-defined frequency.,NIST SP 800-53 Revision 5,Policy
CCI-001779,Defines the frequency on which the system component inventory is to be reviewed and updated.,NIST SP 800-53 Revision 5,Policy
CCI-001780,Review and update the system component inventory per organization-defined frequency.,NIST SP 800-53 Revision 5,Policy
CCI-001783,"Defines the personnel or roles to be notified when unauthorized hardware, software, and firmware components are detected within the system.",NIST SP 800-53 Revision 5,Policy
CCI-001784,"When unauthorized hardware, software, and firmware components are detected within the system, take action to disable network access by such components; isolate the components, and/or notify organization-defined personnel or roles.",NIST SP 800-53 Revision 5,Policy
CCI-001785,Provide a centralized repository for the inventory of system components.,NIST SP 800-53 Revision 5,Policy
CCI-001786,Support the tracking of system components by geographic location using organization-defined automated mechanisms.,NIST SP 800-53 Revision 5,Policy
CCI-001788,Assign system components to a system.,NIST SP 800-53 Revision 5,Policy
CCI-001789,Receive an acknowledgement from organization-defined personnel or roles of the acquired system components to a system.,NIST SP 800-53 Revision 5,Policy
CCI-001792,Implement a configuration management plan for the system that establishes a process for identifying configuration items throughout the system development life cycle.,NIST SP 800-53 Revision 5,Policy
CCI-001795,Implement a configuration management plan for the system that establishes a process for managing the configuration of the configuration items.,NIST SP 800-53 Revision 5,Policy
CCI-001798,Implement a configuration management plan for the system that places the configuration items under configuration management.,NIST SP 800-53 Revision 5,Policy
CCI-001799,Develop and document a configuration management plan for the system that protects the configuration management plan from unauthorized disclosure and modification.,NIST SP 800-53 Revision 5,Policy
CCI-001801,Implement a configuration management plan for the system that protects the configuration management plan from unauthorized disclosure and modification.,NIST SP 800-53 Revision 5,Policy
CCI-001802,Track the use of software documentation protected by quantity licenses to control copying of the software documentation.,NIST SP 800-53 Revision 5,Policy
CCI-001803,Track the use of software protected by quantity licenses to control distribution of the software.,NIST SP 800-53 Revision 5,Policy
CCI-001804,Defines the policies for governing the installation of software by users.,NIST SP 800-53 Revision 5,Policy
CCI-001805,Establish organization-defined policies governing the installation of software by users.,NIST SP 800-53 Revision 5,Policy
CCI-001806,Defines methods to be employed to enforce the software installation policies.,NIST SP 800-53 Revision 5,Policy
CCI-001807,Enforce software installation policies through organization-defined methods.,NIST SP 800-53 Revision 5,Policy
CCI-001808,Defines the frequency on which it will monitor software installation policy compliance.,NIST SP 800-53 Revision 5,Policy
CCI-001809,Monitor software installation policy compliance per an organization-defined frequency.,NIST SP 800-53 Revision 5,Policy
CCI-001813,Enforce access restrictions using organization-defined mechanisms.,NIST SP 800-53 Revision 5,Technical
CCI-001815,Defines the controls to be applied to devices when individuals return from areas of significant risk.,NIST SP 800-53 Revision 5,Policy
CCI-001816,Apply organization-defined controls to the systems or components when the individuals return from travel.,NIST SP 800-53 Revision 5,Policy
CCI-001817,"When analyzing changes to the system, looks for privacy impacts due to flaws, weaknesses, incompatibility, or intentional malice.",NIST SP 800-53 Revision 5,Policy
CCI-001818,Analyze changes to the system in a separate test environment before installation in an operational environment.,NIST SP 800-53 Revision 5,Policy
CCI-001819,Implement approved configuration-controlled changes to the system.,NIST SP 800-53 Revision 5,Policy
CCI-001821,Defines the organizational personnel or roles to whom the organization-level; mission/business process-level; and/or system-level configuration management policy is to be disseminated.,NIST SP 800-53 Revision 5,Policy
CCI-001822,Disseminate the organization-level; mission/business process-level; and/or system-level configuration management policy to organization-defined personnel or roles.,NIST SP 800-53 Revision 5,Policy
CCI-001824,Defines the organizational personnel or roles to whom the organization-level; mission/business process-level; and/or system-level configuration management procedures are to be disseminated.,NIST SP 800-53 Revision 5,Policy
CCI-001825,Disseminate to organization-defined personnel or roles the procedures to facilitate the implementation of the organization-level; mission/business process-level; and/or system-level configuration management policy and associated configuration management controls.,NIST SP 800-53 Revision 5,Policy
CCI-001832,Disseminate the organization-level; mission/business process-level; and/or system-level audit and accountability policy to organization-defined personnel or roles.,NIST SP 800-53 Revision 5,Policy
CCI-001834,Disseminate to organization-defined personnel or roles procedures to facilitate the implementation of the audit and accountability policy and associated audit and accountability controls.,NIST SP 800-53 Revision 5,Policy
CCI-001848,Defines the audit log retention requirements for allocating audit log storage capacity.,NIST SP 800-53 Revision 5,Policy
CCI-001849,Allocate audit log storage capacity to accommodate organization-defined audit record retention requirements.,NIST SP 800-53 Revision 5,"Technical,Policy"
CCI-001850,Defines the frequency to off-load audit records onto a different system or media than the system being audited.,NIST SP 800-53 Revision 5,Policy
CCI-001851,"Transfer audit logs per organization-defined frequency to a different system, system component, or media than the system or system component conducting the logging.",NIST SP 800-53 Revision 5,Technical
CCI-001852,"Defines the personnel, roles and/or locations to receive a warning when allocated audit log storage volume reaches a defined percentage of maximum audit log storage capacity.",NIST SP 800-53 Revision 5,Policy
CCI-001853,"Defines the time period within which organization-defined personnel, roles, and/or locations are to receive warnings when allocated audit log storage volume reaches an organization-defined percentage of maximum audit log storage capacity.",NIST SP 800-53 Revision 5,Policy
CCI-001854,"Defines the percentage of maximum audit log storage capacity that is to be reached, at which time the system will provide a warning to organization-defined personnel, roles, and/or locations.",NIST SP 800-53 Revision 5,Policy
CCI-001855,"Provide a warning to organization-defined personnel, roles, and/or locations within an organization-defined time period when allocated audit log storage volume reaches an organization-defined percentage of repository maximum audit log storage capacity.",NIST SP 800-53 Revision 5,Technical
CCI-001856,Defines the real-time period in which to provide an alert when organization-defined audit failure events occur.,NIST SP 800-53 Revision 5,Policy
CCI-001857,"Defines the personnel, roles, and/or locations to receive alerts when organization-defined audit failure events occur.",NIST SP 800-53 Revision 5,Policy
CCI-001858,"Provide an alert in an organization-defined real-time-period to organization-defined personnel, roles, and/or locations when organization-defined audit failure events requiring real-time alerts occur.",NIST SP 800-53 Revision 5,Technical
CCI-001859,"Defines the network communication traffic volume thresholds reflecting limits on auditing capacity, specifying when the information system will reject or delay network traffic that exceed those thresholds.",NIST SP 800-53 Revision 5,Policy
CCI-001860,"Defines the audit logging failures which, should they occur, will invoke an organization-defined system mode.",NIST SP 800-53 Revision 5,Policy
