CCI ID,Description,NIST Revision,Type
CCI-004267,Defines the protective measure employed against electromagnetic pulse damage for organization-defined systems and system components.,NIST SP 800-53 Revision 5,Policy
CCI-004268,Defines the systems and system components in which organization-defined protective measures are employed against electromagnetic pulse damage.,NIST SP 800-53 Revision 5,Policy
CCI-004269,"Mark organization-defined system hardware components indicating the impact or classification level of the information permitted to be processed, stored, or transmitted by the hardware component.",NIST SP 800-53 Revision 5,Policy
CCI-004270,"Defines the system hardware components which are marked, indicating the impact or classification level of the information permitted to be processed, stored, or transmitted by the hardware component.",NIST SP 800-53 Revision 5,Policy
CCI-004271,Plan the location or site of the facility where the system resides considering physical and environmental hazards.,NIST SP 800-53 Revision 5,Policy
CCI-004272,"For existing facilities, consider the physical and environmental hazards in the organizational risk management strategy.",NIST SP 800-53 Revision 5,Policy
CCI-004273,"Develop and document an organization-level; mission/business process-level; and or system-level planning policy that is consistent with applicable laws, Executive Orders, directives, regulations, policies, standards, and guidelines.",NIST SP 800-53 Revision 5,Policy
CCI-004274,Designate an organization-defined official to manage the development and documentation of the planning policy and procedures.,NIST SP 800-53 Revision 5,Policy
CCI-004275,Designate an organization-defined official to manage the dissemination of the planning policy and procedures.,NIST SP 800-53 Revision 5,Policy
CCI-004276,Review and update the current planning policy following organization-defined events.,NIST SP 800-53 Revision 5,Policy
CCI-004277,Review and update the current planning procedures following organization-defined events.,NIST SP 800-53 Revision 5,Policy
CCI-004278,Develop security and privacy plans for the system that identify the individuals that fulfill system roles and responsibilities.,NIST SP 800-53 Revision 5,Policy
CCI-004279,"Develop security and privacy plans for the system that identify the information types processed, stored, and transmitted by the system.",NIST SP 800-53 Revision 5,Policy
CCI-004280,Develop security and privacy plans for the system that describe any specific threats to the system that are of concern to the organization.,NIST SP 800-53 Revision 5,Policy
CCI-004281,Develop security and privacy plans for the system that provide the results of a privacy risk assessment for the systems processing personally identifiable information.,NIST SP 800-53 Revision 5,Policy
CCI-004282,Develop security and privacy plans for the system that include risk determinations for security and privacy architecture and design decisions.,NIST SP 800-53 Revision 5,Policy
CCI-004283,Develop security and privacy plans for the system that include security- and privacy-related activities affecting the system that require planning and coordination with organization-defined individuals or groups.,NIST SP 800-53 Revision 5,Policy
CCI-004284,"Establish the rules describing the responsibilities and expected behavior, for security, for individuals requiring access to the system.",NIST SP 800-53 Revision 5,Policy
CCI-004285,"Establish the rules describing the responsibilities and expected behavior, for privacy, for individuals requiring access to the system.",NIST SP 800-53 Revision 5,Policy
CCI-004286,"Provide the rules describing the responsibilities and expected behavior, for information and system usage, for individuals requiring access to the system.",NIST SP 800-53 Revision 5,Policy
CCI-004287,"Provide the rules describing the responsibilities and expected behavior, for security, for individuals requiring access to the system.",NIST SP 800-53 Revision 5,Policy
CCI-004288,"Provide the rules describing the responsibilities and expected behavior, for privacy, for individuals requiring access to the system.",NIST SP 800-53 Revision 5,Policy
CCI-004289,Defines the frequency individuals are required to read and re-acknowledge the rules of behavior whenever the rules are revised or updated.,NIST SP 800-53 Revision 5,Policy
CCI-004290,"Include in the rules of behavior, restrictions on use of organization-provided identifiers (e.g., email addresses) and authentication secrets (e.g., passwords) for creating accounts on external sites/applications.",NIST SP 800-53 Revision 5,Policy
CCI-004291,Develop a security Concept of Operations (CONOPS) for the system describing how the organization intends to operate the system from the perspective of information privacy.,NIST SP 800-53 Revision 5,Policy
CCI-004292,Develop privacy architectures for the system.,NIST SP 800-53 Revision 5,Policy
CCI-004293,"Develop privacy architectures for the system that describes the requirements and approach to be taken for protecting the confidentiality, integrity, and availability of organizational information.",NIST SP 800-53 Revision 5,Policy
CCI-004294,Develop security architectures for the system that describe the requirements and approach to be taken for processing personally identifiable information to minimize privacy risk to individuals.,NIST SP 800-53 Revision 5,Policy
CCI-004295,Develop privacy architectures for the system that describe the requirements and approach to be taken for processing personally identifiable information to minimize privacy risk to individuals.,NIST SP 800-53 Revision 5,Policy
CCI-004296,Develop privacy architectures for the system that describe how the architectures are integrated into and support the enterprise architecture.,NIST SP 800-53 Revision 5,Policy
CCI-004297,"Develop privacy architectures for the system that describe any assumptions about, and dependencies on, external systems and services.",NIST SP 800-53 Revision 5,Policy
CCI-004298,Reflect planned privacy architecture changes in the privacy plans.,NIST SP 800-53 Revision 5,Policy
CCI-004299,Reflect planned privacy architecture changes in the privacy Concept of Operations (CONOPS).,NIST SP 800-53 Revision 5,Policy
CCI-004300,Reflect planned privacy architecture changes in the privacy organizational procurements and acquisitions.,NIST SP 800-53 Revision 5,Policy
CCI-004301,Design the privacy architecture for the system using a defense-in-depth approach that allocates organization-defined controls to organization-defined locations.,NIST SP 800-53 Revision 5,Policy
CCI-004302,Design the privacy architecture for the system using a defense-in-depth approach that allocates organization-defined controls to organization-defined architectural layers.,NIST SP 800-53 Revision 5,Policy
CCI-004303,Defines the controls to be allocated to organization-defined locations for the privacy architecture.,NIST SP 800-53 Revision 5,Policy
CCI-004304,Defines the controls to be allocated to the organization-defined privacy architectural layers.,NIST SP 800-53 Revision 5,Policy
CCI-004305,Defines the locations to which the system allocates organization-defined controls in the privacy architecture.,NIST SP 800-53 Revision 5,Policy
CCI-004306,Defines the architectural layers to which the system allocates organization-defined controls in the privacy architecture.,NIST SP 800-53 Revision 5,Policy
CCI-004307,Design the privacy architecture for the system using a defense-in-depth approach that ensures that the allocated controls operate in a coordinated and mutually reinforcing manner.,NIST SP 800-53 Revision 5,Policy
CCI-004308,Defines the controls that are allocated to the organization-defined locations and architectural layers.,NIST SP 800-53 Revision 5,Policy
CCI-004309,Defines the locations and architectural layers that are obtained from different suppliers.,NIST SP 800-53 Revision 5,Policy
CCI-004310,Select a control baseline for the system.,NIST SP 800-53 Revision 5,Policy
CCI-004311,Tailor the selected control baseline by applying specified tailoring actions.,NIST SP 800-53 Revision 5,Policy
CCI-004312,Review and update the organization-wide information security program plan following organization-defined events.,NIST SP 800-53 Revision 5,Policy
CCI-004313,Defines the events for reviewing and updating the organization-wide information security program plan.,NIST SP 800-53 Revision 5,Policy
CCI-004314,Include the resources needed to implement the information security programs in capital planning and investment requests.,NIST SP 800-53 Revision 5,Policy
CCI-004315,Include the resources needed to implement the information privacy programs in capital planning and investment requests.,NIST SP 800-53 Revision 5,Policy
CCI-004316,"Prepare documentation required for addressing information security programs in capital planning and investment requests in accordance with applicable laws, Executive Orders, directives, policies, regulations, and standards.",NIST SP 800-53 Revision 5,Policy
CCI-004317,"Prepare documentation required for addressing information privacy programs in capital planning and investment requests in accordance with applicable laws, Executive Orders, directives, policies, regulations, and standards.",NIST SP 800-53 Revision 5,Policy
CCI-004318,"Make available for expenditure, the planned information privacy resources.",NIST SP 800-53 Revision 5,Policy
CCI-004319,Implement a process to ensure that plans of action and milestones for the privacy program and the associated organizational systems are maintained.,NIST SP 800-53 Revision 5,Policy
CCI-004320,Implement a process to ensure that plans of action and milestones for the privacy program and associated organizational systems are developed.,NIST SP 800-53 Revision 5,Policy
CCI-004321,Implement a process to ensure that plans of action and milestones for the supply chain risk management programs and the associated organizational systems are maintained.,NIST SP 800-53 Revision 5,Policy
CCI-004322,Implement a process to ensure that plans of action and milestones for the supply chain risk management programs and the associated organizational systems are developed.,NIST SP 800-53 Revision 5,Policy
CCI-004323,"Implement a process to ensure that plans of action and milestones for the privacy program and associated organizational systems document the remedial information privacy actions to adequately respond to risk to organizational operations and assets, individuals, other organizations, and the Nation.",NIST SP 800-53 Revision 5,Policy
CCI-004324,"Implement a process to ensure that plans of action and milestones for the supply chain risk management program and associated organizational systems document the remedial information supply chain risk management actions to adequately respond to risk to organizational operations and assets, individuals, other organizations, and the Nation.",NIST SP 800-53 Revision 5,Policy
CCI-004325,Implement a process to ensure that plans of action and milestones for the security program and associated organizational systems are reported in accordance with established reporting requirements.,NIST SP 800-53 Revision 5,Policy
CCI-004326,Implement a process to ensure that plans of action and milestones for the privacy program and associated organizational systems are reported in accordance with established reporting requirements.,NIST SP 800-53 Revision 5,Policy
CCI-004327,Implement a process to ensure that plans of action and milestones for the supply chain risk management program and associated organizational systems are reported in accordance with established reporting requirements.,NIST SP 800-53 Revision 5,Policy
CCI-004328,Develop an inventory of organizational systems.,NIST SP 800-53 Revision 5,Policy
CCI-004329,"Update, on an organization-defined frequency, an inventory of organizational systems.",NIST SP 800-53 Revision 5,Policy
CCI-004330,Defines the frequency with which to update the inventory of organizational systems.,NIST SP 800-53 Revision 5,Policy
CCI-004331,"Establish an inventory of all systems, applications, and projects that process personally identifiable information.",NIST SP 800-53 Revision 5,Policy
CCI-004332,"Maintain an inventory of all systems, applications, and projects that process personally identifiable information.",NIST SP 800-53 Revision 5,Policy
CCI-004333,"Update on an organization-defined frequency, an inventory of all systems, applications, and projects that process personally identifiable information.",NIST SP 800-53 Revision 5,Policy
CCI-004334,"Defines the frequency of which an inventory of all systems, applications, and projects that process personally identifiable information will be updated.",NIST SP 800-53 Revision 5,Policy
CCI-004335,Develop the results of information privacy measures of performance.,NIST SP 800-53 Revision 5,Policy
CCI-004336,Monitor the results of information privacy measures of performance.,NIST SP 800-53 Revision 5,Policy
CCI-004337,Report on the results of information privacy measures of performance.,NIST SP 800-53 Revision 5,Policy
CCI-004338,"Develop an enterprise architecture with consideration for information privacy and the resulting risk to organizational operations, organizational assets, individuals, other organizations, and the Nation.",NIST SP 800-53 Revision 5,Policy
CCI-004339,"Maintain an enterprise architecture with consideration for information security and the resulting risk to organizational operations, organizational assets, individuals, other organizations, and the Nation.",NIST SP 800-53 Revision 5,Policy
CCI-004340,"Maintain an enterprise architecture with consideration for information privacy and the resulting risk to organizational operations, organizational assets, individuals, other organizations, and the Nation.",NIST SP 800-53 Revision 5,Policy
CCI-004341,"Offload organization-defined non-essential functions or services to other systems, system components, or an external provider.",NIST SP 800-53 Revision 5,Policy
CCI-004342,"Defines the non-essential functions or services to be offloaded to other systems, system components, or an external provider.",NIST SP 800-53 Revision 5,Policy
CCI-004343,Address information privacy issues in the development and documentation of a critical infrastructure and key resources protection plan.,NIST SP 800-53 Revision 5,Policy
CCI-004344,Address information privacy issues in the updating of a critical infrastructure and key resources protection plan.,NIST SP 800-53 Revision 5,Policy
CCI-004345,Develop a comprehensive strategy to manage privacy risk to individuals resulting from the authorized processing of personally identifiable information.,NIST SP 800-53 Revision 5,Policy
CCI-004346,Manage the security state of organizational systems and the environments in which those systems operate through authorization processes.,NIST SP 800-53 Revision 5,Policy
CCI-004347,Manage the privacy state of organizational systems and the environments in which those systems operate through authorization processes.,NIST SP 800-53 Revision 5,Policy
CCI-004348,"Define organizational mission and business processes with consideration for information privacy and the resulting risk to organizational operations, organizational assets, individuals, other organizations, and the Nation.",NIST SP 800-53 Revision 5,Policy
CCI-004349,Determine personally identifiable information processing needs arising from the defined mission and business processes.,NIST SP 800-53 Revision 5,Policy
CCI-004350,Review and revise the mission and business processes on an organization-defined frequency.,NIST SP 800-53 Revision 5,Policy
CCI-004351,Defines the frequency at which the mission and business processes are reviewed and revised.,NIST SP 800-53 Revision 5,Policy
CCI-004352,Establish a privacy workforce development and improvement program.,NIST SP 800-53 Revision 5,Policy
CCI-004353,Implement a process for ensuring that organizational plans for conducting privacy testing activities associated with organizational systems are developed.,NIST SP 800-53 Revision 5,Policy
CCI-004354,Implement a process for ensuring that organizational plans for conducting privacy testing activities associated with organizational systems are maintained.,NIST SP 800-53 Revision 5,Policy
CCI-004355,Implement a process for ensuring that organizational plans for conducting privacy training activities associated with organizational systems are developed.,NIST SP 800-53 Revision 5,Policy
CCI-004356,Implement a process for ensuring that organizational plans for conducting privacy training activities associated with organizational systems are maintained.,NIST SP 800-53 Revision 5,Policy
CCI-004357,Implement a process for ensuring that organizational plans for conducting privacy monitoring activities associated with organizational systems are developed.,NIST SP 800-53 Revision 5,Policy
CCI-004358,Implement a process for ensuring that organizational plans for conducting privacy monitoring activities associated with organizational information systems are maintained.,NIST SP 800-53 Revision 5,Policy
CCI-004359,Implement a process for ensuring that organizational plans for conducting privacy testing associated with organizational systems continue to be executed.,NIST SP 800-53 Revision 5,Policy
CCI-004360,Implement a process for ensuring that organizational plans for conducting privacy training associated with organizational systems continue to be executed.,NIST SP 800-53 Revision 5,Policy
CCI-004361,Implement a process for ensuring that organizational plans for conducting privacy monitoring activities associated with organizational systems continue to be executed.,NIST SP 800-53 Revision 5,Policy
CCI-004362,Establish and institutionalize contact with selected groups and associations within the privacy community to facilitate ongoing privacy education and training for organizational personnel.,NIST SP 800-53 Revision 5,Policy
CCI-004363,"Establish and institutionalize contact with selected groups and associations within the privacy community to maintain currency with recommended privacy practices, techniques, and technologies.",NIST SP 800-53 Revision 5,Policy
CCI-004364,"Establish and institutionalize contact with selected groups and associations within the privacy community to share current privacy information including threats, vulnerabilities, and incidents.",NIST SP 800-53 Revision 5,Policy
CCI-004365,Employ automated means to maximize the effectiveness of sharing threat intelligence information.,NIST SP 800-53 Revision 5,Policy
CCI-004366,"Establish policy to ensure that the requirements for the protection of Controlled Unclassified Information that is processed, stored or transmitted on external systems, are implemented in accordance with applicable laws, Executive Orders, directives, policies, regulations, and standards.",NIST SP 800-53 Revision 5,Policy
CCI-004367,"Establish procedures to ensure that the requirements for the protection of Controlled Unclassified Information that is processed, stored or transmitted on external systems, are implemented in accordance with applicable laws, Executive Orders, directives, policies, regulations, and standards.",NIST SP 800-53 Revision 5,Policy
CCI-004368,Review and update the policy for Controlled Unclassified Information on an organization-defined frequency.,NIST SP 800-53 Revision 5,Policy
CCI-004369,Defines the frequency in which the policy for Controlled Unclassified information is reviewed and updated.,NIST SP 800-53 Revision 5,Policy
CCI-004370,Review and update the procedures for Controlled Unclassified Information on an organization-defined frequency.,NIST SP 800-53 Revision 5,Policy
CCI-004371,Defines the frequency in which the procedures for Controlled Unclassified information is reviewed and updated.,NIST SP 800-53 Revision 5,Policy
CCI-004372,Develop an organization-wide privacy program plan that provides an overview of the agency's privacy program.,NIST SP 800-53 Revision 5,Policy
CCI-004373,Disseminate an organization-wide privacy program plan that provides an overview of the agency's privacy program.,NIST SP 800-53 Revision 5,Policy
CCI-004374,Develop an organization-wide privacy program plan that provides an overview of the agency's privacy program and includes a description of the structure of the privacy program and the resources dictated to the privacy program.,NIST SP 800-53 Revision 5,Policy
CCI-004375,Disseminate an organization-wide privacy program plan that provides an overview of the agency's privacy program and includes a description of the structure of the privacy program and the resources dictated to the privacy program.,NIST SP 800-53 Revision 5,Policy
CCI-004376,Develop an organization-wide privacy program plan that provides an overview of the agency's privacy program and provides an overview of the requirements for the privacy program.,NIST SP 800-53 Revision 5,Policy
CCI-004377,Disseminate an organization-wide privacy program plan that provides an overview of the agency's privacy program and provides an overview of the requirements for the privacy program.,NIST SP 800-53 Revision 5,Policy
CCI-004378,Develop an organization-wide privacy program plan that provides an overview of the agency's privacy program and a description of the privacy program management controls and common controls in place or planned for meeting those requirements.,NIST SP 800-53 Revision 5,Policy
CCI-004379,Disseminate an organization-wide privacy program plan that provides an overview of the agency's privacy program and a description of the privacy program management controls and common controls in place or planned for meeting those requirements.,NIST SP 800-53 Revision 5,Policy
CCI-004380,Develop an organization-wide privacy program plan that provides an overview of the agency's privacy program and includes the role of the Senior Agency Official for Privacy and the identification and assignment of the roles of other privacy officials and staff and their responsibilities.,NIST SP 800-53 Revision 5,Policy
CCI-004381,Disseminate an organization-wide privacy program plan that provides an overview of the agency's privacy program and includes the role of the Senior Agency Official for Privacy and the identification and assignment of the roles of other privacy officials and staff and their responsibilities.,NIST SP 800-53 Revision 5,Policy
CCI-004382,"Develop an organization-wide privacy program plan that provides an overview of the agency's privacy program and describes management commitment, compliance, and the strategic goals and objectives of the privacy program.",NIST SP 800-53 Revision 5,Policy
CCI-004383,"Disseminate an organization-wide privacy program plan that provides an overview of the agency's privacy program and describes management commitment, compliance, and the strategic goals and objectives of the privacy program.",NIST SP 800-53 Revision 5,Policy
CCI-004384,Develop an organization-wide privacy program plan that provides an overview of the agency's privacy program and reflects coordination among organizational entities responsible for the different aspects of privacy.,NIST SP 800-53 Revision 5,Policy
CCI-004385,Disseminate an organization-wide privacy program plan that provides an overview of the agency's privacy program and reflects coordination among organizational entities responsible for the different aspects of privacy.,NIST SP 800-53 Revision 5,Policy
CCI-004386,"Develop an organization-wide privacy program plan that provides an overview of the agency's privacy program and is approved by a senior official with responsibility and accountability for the privacy risk being incurred to organizational operations (including mission, functions, image, and reputation), organizational assets, individuals, other organizations, and the Nation.",NIST SP 800-53 Revision 5,Policy
CCI-004387,"Disseminate an organization-wide privacy program plan that provides an overview of the agency's privacy program and is approved by a senior official with responsibility and accountability for the privacy risk being incurred to organizational operations (including mission, functions, image, and reputation), organizational assets, individuals, other organizations, and the Nation.",NIST SP 800-53 Revision 5,Policy
CCI-004388,Update the plan on an organization-defined frequency.,NIST SP 800-53 Revision 5,Policy
CCI-004389,Update the plan to address changes in federal privacy laws and policy and organizational changes and problems identified during plan implementation or privacy control assessments.,NIST SP 800-53 Revision 5,Policy
CCI-004390,"Appoint a Senior Agency Official for Privacy with the authority, mission, accountability, and resources to coordinate applicable privacy requirements.",NIST SP 800-53 Revision 5,Policy
CCI-004391,"Appoint a Senior Agency Official for Privacy with the authority, mission, accountability, and resources to develop applicable privacy requirements.",NIST SP 800-53 Revision 5,Policy
CCI-004392,"Appoint a Senior Agency Official for Privacy with the authority, mission, accountability, and resources to implement applicable privacy requirements.",NIST SP 800-53 Revision 5,Policy
CCI-004393,"Appoint a Senior Agency Official for Privacy with the authority, mission, accountability, and resources to manage privacy risks through the organization-wide privacy program.",NIST SP 800-53 Revision 5,Policy
CCI-004394,Maintain a central resource webpage on the organization's principle public website that serves as a central source of information about the organization's privacy plan.,NIST SP 800-53 Revision 5,Policy
CCI-004395,Ensure that the public has access to information about organizational privacy activities.,NIST SP 800-53 Revision 5,Policy
CCI-004396,Ensure that the public can communicate with its Senior Agency Official for Privacy.,NIST SP 800-53 Revision 5,Policy
